{
  "$schema": "https://json-schema.org/draft/2020-12/schema",
  "$id": "urn:conflict:D25_E02_V100:primary_response",
  "type": "object",
  "additionalProperties": false,
  "required": [
    "route_id",
    "contract_version",
    "rubric_version",
    "input_sha256",
    "coder_role",
    "actual_model_label",
    "model_label_source",
    "run_id",
    "completed_at_utc",
    "attestation",
    "entries"
  ],
  "properties": {
    "route_id": {
      "const": "AI_ONLY_DYAD_D25_E02_V100"
    },
    "contract_version": {
      "const": "1.0.0"
    },
    "rubric_version": {
      "const": "2.1.0"
    },
    "input_sha256": {
      "const": "aa256f3c1822eea2494b4267a15f5b65707a86896b457531762b2066387872aa"
    },
    "coder_role": {
      "enum": [
        "D25_E02_V100_AI1",
        "D25_E02_V100_AI2"
      ]
    },
    "actual_model_label": {
      "type": "string",
      "minLength": 1
    },
    "model_label_source": {
      "type": "string",
      "minLength": 1
    },
    "run_id": {
      "type": "string",
      "minLength": 1
    },
    "completed_at_utc": {
      "type": "string",
      "minLength": 1
    },
    "attestation": {
      "type": "object",
      "additionalProperties": false,
      "required": [
        "other_coder_output_seen",
        "prior_episode_outputs_seen",
        "prior_r2_outputs_seen",
        "outcome_used_as_evidence",
        "external_sources_used"
      ],
      "properties": {
        "other_coder_output_seen": {
          "const": false
        },
        "prior_episode_outputs_seen": {
          "const": false
        },
        "prior_r2_outputs_seen": {
          "const": false
        },
        "outcome_used_as_evidence": {
          "const": false
        },
        "external_sources_used": {
          "const": false
        }
      }
    },
    "entries": {
      "type": "array",
      "minItems": 4,
      "maxItems": 4,
      "items": {
        "type": "object",
        "additionalProperties": false,
        "required": [
          "actor_id",
          "factor",
          "status",
          "value",
          "admission_checks",
          "evidence_references",
          "rationale",
          "confidence",
          "calculation_release"
        ],
        "properties": {
          "actor_id": {
            "enum": [
              "D25_DISMISSED_KMG_EP_WORKERS_20111013",
              "D25_KMG_EP_MANAGEMENT_20111013"
            ]
          },
          "factor": {
            "enum": [
              "POS_AO2",
              "KVS_AO2"
            ]
          },
          "status": {
            "enum": [
              "NUMERIC",
              "UNKNOWN",
              "DISPUTED"
            ]
          },
          "value": {
            "type": [
              "number",
              "null"
            ]
          },
          "admission_checks": {
            "type": "object",
            "additionalProperties": false,
            "required": [
              "C1",
              "C2",
              "C3",
              "C4",
              "C5",
              "C6",
              "C7",
              "C8"
            ],
            "properties": {
              "C1": {
                "type": "boolean"
              },
              "C2": {
                "type": "boolean"
              },
              "C3": {
                "type": "boolean"
              },
              "C4": {
                "type": "boolean"
              },
              "C5": {
                "type": "boolean"
              },
              "C6": {
                "type": "boolean"
              },
              "C7": {
                "type": "boolean"
              },
              "C8": {
                "type": "boolean"
              }
            }
          },
          "evidence_references": {
            "type": "array",
            "items": {
              "type": "string",
              "minLength": 1
            }
          },
          "rationale": {
            "type": "string",
            "minLength": 1
          },
          "confidence": {
            "type": "object",
            "additionalProperties": false,
            "required": [
              "kind",
              "value",
              "meaning",
              "rationale"
            ],
            "properties": {
              "kind": {
                "const": "QUALITATIVE_UNCALIBRATED"
              },
              "value": {
                "enum": [
                  "HIGH",
                  "MEDIUM",
                  "LOW",
                  "UNKNOWN"
                ]
              },
              "meaning": {
                "const": "CONFIDENCE_IN_RECORDED_CODING_DECISION"
              },
              "rationale": {
                "type": "string",
                "minLength": 1
              }
            }
          },
          "calculation_release": {
            "const": false
          }
        }
      }
    }
  }
}
